[
  {
    "id": "coverage-east-anglia",
    "question": "Which areas do GetGasCert cover in East Anglia?",
    "answer": "GetGasCert serves Norfolk, Suffolk, Cambridgeshire and Essex across East Anglia, subject to engineer availability for the requested service and location. If you are unsure whether your postcode is covered, contact GetGasCert to confirm availability.",
    "topics": [
      "coverage",
      "service area",
      "East Anglia",
      "Norfolk",
      "Suffolk",
      "Cambridgeshire",
      "Essex",
      "Norwich",
      "location"
    ],
    "source": {
      "type": "owner-approved",
      "reference": "GetGasCert public website service-area page",
      "verifiedAt": "2026-08-13"
    },
    "approved": true
  },
  {
    "id": "booking-availability",
    "question": "How quickly can I book, when can someone attend and do you have availability?",
    "answer": "Availability depends on the service required and your location. You can book online for published services, or contact GetGasCert for commercial projects and the next available appointment can be confirmed.",
    "topics": [
      "booking",
      "availability",
      "appointment",
      "attendance",
      "how soon"
    ],
    "source": {
      "type": "owner-approved",
      "reference": "GetGasCert public website booking guidance",
      "verifiedAt": "2026-08-13"
    },
    "approved": true
  },
  {
    "id": "company-information",
    "question": "Where are you based, who are you and are you Gas Safe registered?",
    "answer": "GetGasCert provides Gas Safe registered gas safety certification and commercial gas engineering services across East Anglia.",
    "topics": [
      "company",
      "location",
      "based",
      "Gas Safe registered",
      "about GetGasCert"
    ],
    "source": {
      "type": "owner-approved",
      "reference": "GetGasCert public website company information",
      "verifiedAt": "2026-08-13"
    },
    "approved": true
  }
]
